file_name,chunk_id,text
mr.pdf,1,two tables name sex gianluca gianluca_mgianluca lucia f lucia_flucia f gianluca_mgianluca mgianluca name sex gianluca mattia mattia_mmattia mattia_mmattia r lucia f gaia f gaia_fgaia f mattia lucia_flucia f name sex gaia f gianluca gianluca_mgianluca gaia_fgaia f stijn stijn_mstijn stijn stijn_mstijn unionrnamesexandsnamesex 17103 mr example intersection two tables name sex gianluca gianluca_mgianluca lucia f map lucia_flucia f gianluca_mgianluca mgianluca mattia mattia_mmattia mattia_mmattia red name sex gaia f gaia_fgaia f gianluca lucia_flucia f name sex gianluca map gianluca_mgianluca gaia_fgaia f stijn_mstijn stijn stijn_mstijn intersectionofrnamesexandsnamesex 18103 mr implementation relational operations differencers map foratupletinrproducekeyvaluepairtrandforatupletins producekeyvaluepairts reduce foreachkeytiftheassociatedvaluelistisrthenreturnt otherwisereturnnothing joinrabcid46cid47 sbc b map foreachtupleabofrproducethekeyvaluepairbra eachtuplebcofsproducethekeyvaluepairbsc reduce eachkeyvaluebwillbeassociatedwithalistofpairsoftheform raorsc constructfromthosepairsallpossibletriplesoftheform abc 19103 mr example difference two tables name sex gianluca gianluca_mr gianluca_mrs map lucia f lucia_fr r mattia mattia_mr mattia_mr name sex red gaia f gaia_fr lucia f lucia_fr mattia name sex gianluca map gianluca_ms gaia_fr gaia f stijn stijn_ms stijn_ms differencernamesexsnamesex 20103 mr example join two tables name id gianluca 11 1rgianluca lucia 2 2rlucia r name job map 1rgianluca sprof mattia 2 2rmattia gianluca prof 1 red gaia 3 3rgaia 2rluciarmattiasstudent lucia student 2 id job mattia student 2 3rgaia spupil 1 prof 1sprof gaia pupil 3 2 student 2sstudent 3 pupil 3spupil joinrnameidcid46cid47 sidjob id 21103 mr implementation relational operations considertherelationrabc groupingonaandaggregationonb γ rabc aθb map foreachtupleabcproducethekeyvaluepairab reduce eachkeyarepresentsagroup applytheaggregationoperatortothe listofbvaluesassociatedwithkeya theoutputisthepairaxwherexis theresultofaggregation incaseofseveralgroupingattributesthekeyisalistofvaluesofa tupleforthoseattributes incaseofseveralaggregationstheresultof aggregationisalistofvaluestoo 22103 mr example grouping aggregation job age prof 52 map prof52 job age_sum r student 21 student21 prof5247 red prof 99 prof 47 prof47 student211822 student 61 student 18 student18 student 22 student22 γ jobcid80agerjobage groupingonjobandaggregationsumonage 23103 matrix multiplication relational form letusconsidertheproductpmnwheremism nisn n r c r c n c r thegenericelementofpis cid88mc p n ik ij jk j1 thismultiplicationcanbeinterpretedinarelationalformparticularly usefulinthecaseofsparsematriceswhere matrixmisarelationmijvwithtuplesijm ij matrixnisarelationnjkvwithtuplesjkn jk multiplicationasthesequenceof 1 naturaljoinonattributej 2 groupingoniandkand 3 aggregationsum 24103 cid34 cid35cid34 cid35
mr.pdf,2,cid34 cid35 n n n n n n n n n 11 12 11 12 13 11 11 12 21 11 12 12 22 11 13 12 23 n n n n n n n n n 21 22 21 22 23 21 11 22 12 21 12 22 22 21 13 22 23 j k n 1 1 n j 11 1 2 n 12 1 1 11 1 3 n r 1 1 2 12 r 2 1 3 2 1 21 3 1 n 31 2 2 22 3 2 n 32 3 3 n 33 25103 j k n 1 1 1 n 11 11 1 1 2 n 11 12 1 1 3 n k p 11 13 2 1 1 n 1 1 n n 21 11 11 11 12 21 2 1 2 n 1 2 n n 21 12 11 12 12 22 r 1 cid46cid47 j r 2 2 1 3 21 n 13 γ iksummn 1 3 11n 13m 12n 23 1 2 1 n 2 1 n n 12 21 21 11 22 21 1 2 2 n 2 2 n n 12 22 21 12 22 22 1 2 3 n 2 3 n n 12 23 21 13 22 23 2 2 1 n 22 21 2 2 2 n 22 22 2 2 3 n 22 23 26103 matrix multiplication mr two steps step1 map foreachelementofmproducejmim andforeachelement ij ofnproducejnkn jk reduce foreachkeyjconsiderallthepairsofelementscomingfromm andnandcomputem n andreturnikm n ij jk ij jk step2 map identityfunction reduce foreachkeyikreturnthesumofthelistofvalues associatedwiththekey 27103 matrix multiplication mr single step matrixmm ofsizem ik r c matrixnn ofsizen n andm n jk r c c r map 1 foreachelementofmproduceikjmm ij i12mk12n j1m r c c 2 foreachelementofnproduceikjnn jk i12mk12n j1m r c c reduce foreachkeyikconsiderallthepairsjmm
mr.pdf,3,andjnn ij jk sortthemaccordingtothejmultiplythevaluescorrespondingtothe samejandsumthem 28103 ikjmmij 111m1 131m1 121m1 141m1 112m2 132m2 122m2 142m2 1 2 211m3 231m3 1 1 2 221m3 241m3 111m1 2m2 1n1 2n5 1125 212m4 232m4 2 3 4 222m4 242m4 121m1 2m2 1n2 2n6 1226 311m5 331m5 3 5 6 321m5 341m5 131m1 2m2 1n3 2n7 1327 312m6 332m6 141m1 2m2 1n4 2n8 1428 322m6 342m6 map 211m3 2m4 1n1 2n5 3145 11 14 17 20 ikjnnjk 221m3 2m4 1n2 2n6 3246 r e 23 27 37 44 111n1 211n1 311n1 231m3 2m4 1n3 2n7 3347 68 121n2 1 2 3 4 221n2 321n2 241m3 2m4 1n4 2n8 3448 131n3 1 1 2 3 4 231n3 331n3 2 5 6 7 8 141n4 241n4 341n4 341m5 2m6 1n4 2n8 5468 112n5 212n5 312n5 122n6 222n6 322n6 132n7 232n7 332n7 142n8 242n8 342n8 29103 roadmap scalability big data analytics practice twopossiblesolutions 1 usesomerecentopensourcemachinelearningplatformsforbigdata mahoutontopofhadoop itimplementsclassificationperceptronlogistic regressionnaivebayesrandomforestsvmclusteringlocallyweighted regressionsvdsingularvaluedecompositionpcaica tridentmlontopofstorm itimplementslinearclassificationperceptron linearregressionclusteringfeaturescalingstandardizationnormalization mllibontopofspark itimplementsiniterativemannerbinaryclassification svmandlogisticregressionlinearregressionclusteringkmean collaborativefilteringforrecommendersystem 2 redesignandoradaptalgorithmsinascalablemanneraccordingto themrparadigm 31103 distribution learning algorithms wewillconsideranumberofalgorithms supervisedlearning regression leastsquares classification naivebayesclassification regressionclassification knn averagingalgorithms unsupervisedlearning kmeans featureselection rankingcorrelation mrmrfeatureselection 32103 nota bene mrisnot asolutiontoeveryproblemnoteveneveryproblemthat profitablycanusemanycomputenodesoperatinginparallel theuseofadistributedfilesystemmakessenseonlywhenfilesare verylargeandarerarelyupdatedinplace thecommunicationcostisthedominantcostsinceeachsingletaskis typicallyverysimpleandtheinterconnectspeedofacomputingcluster ismuchlowerthantheprocessorexecutionspeed differentmrimplementationsofthesamealgorithmmayinduce differentcommunicationcosts 33103 routes scalability makenotallmlalgorithmsscalablebyusingoneoftheseprinciples 1 summationprinciple expectation costfunction gradient loglikelihood frequency meanvariance 2 independenttasks featureranking crossvalidationbagging testing modelselectionracing 3 statisticalsamplingpropertiesestimation 4 divideandconquerstrategy nonlineardependencedecomposedinto localsimplerdependencies 34103 summation form principle mlandsumsarestronglyrelated accuracyofalearnereg meansquarederrorexpressedasafunction typicallyexpectationofthedatadistribution estimationoftheaccuracyonthebasisofdataeg bycrossvalidation requiresthecomputationofsampledversionsoftheexpectationie meansorsumsoverthedata averagingapproacheseg baggingrelyonaverages probabilityestimationsviafrequencyrequirecomputationsofsums trainingcostfunctionscanbewrittenassums forinstancesumof squarederrors iftheerrorcostfunctionisasumthegradientoftheerrorisasumtoo 35103 summation form principle onceanalgorithmdoessumsoverthedatawecaneasilydistributethe calculationsovermultipleworkerseg cores abcdefabcdef wefirstdividethedatasetintoasmanypiecesasworkerspartitioning thenwegiveeachworkerablockofdatascatter eventuallyweaggregatetheresultsgather wellknownexampleofalgorithminsummationformisleastsquares sumisanexampleofmonoidoperatorthatcanbeeasilymadeparallel inthereducestep 36103 monoids mr amonoidiscomposedbyasetsanassociativebinarymapping sssandanidentityelement anassociativeoperationsatisfiesthefollowingequalityforallabc abcabc inmramapperisnotconstrainedwhilethereducermaybedistributed byimplementingtheiteratedapplicationofanassociativeoperation commutativemonoids maxadditionmultiplicationunion intersection maxamaxbcmaxmaxabc nonmonoids meanmediansubtraction avg12345cid54avgavg123avg45 sinceaverageisnotassociativebutsumandcountarethereduce implementationofaveragereliesonsumandcounting 37103 key value job age prof 52 map prof52 red job age_mean r st pu rd oe fnt 2 41 7 pu rd oe fn 4t 72 1 stu dp ero nf
mr.pdf,4,5 22 1 4 17 8 22 noid stp ur ef nt 24 09 35 3 student 18 student18 student 22 student22 key value count job age prof 52 map prof521 r student 21 2u 1d 1e n prof521471 prof992 mr one od job age_mean prof 47 prof471 student211181 student392221 prof 495 student 18 student student 2033 181 student 22 student student 221 221 38103 independence severalphasesofmlpipelinemaybecarriedoutindependentlywhere independencecanbeinterpretedbothincomputationalno communicationandstatisticalnoinformationsense predictionfordifferenttestvaluesnotethatpredictionisthemost expensivestepinsomealgorithmslazy crossvalidation averagingofestimatorsbagging univariaterankingoffeaturesassumptionofindependence generationofiid subsamples conditionalindependencenaivebayes 39103 statistical sampling statisticalsampling itallowsinferencesaboutapopulationtobemade fromobservationsmadeonarelativelysmallnumberofindividualsin thepopulationthesample theideaistousetheoriginalbigdatasetasthepopulationand portionsofitassamplestoinferpropertiesoftheoriginaldataset mapcancreateseveralsubsamplesthatcanbeparallellyanalysedat thereducelevel 40103 divideandconquer learningstrategythatattacksacomplexproblembydividingitinto simplerproblemswhosesolutionscanbecombinedtoyieldasolutionto theoriginalproblem thisprinciplepresentstwomainadvantages 1 simplerproblemscanbesolvedwithsimplerestimationtechniquesin statisticsthismeanstoadoptlineartechniqueswellstudiedand developedovertheyears 2 thelearningmethodcanbetteradjusttothepropertiesoftheavailable dataset examples radialbasisfunctionknnlocallearning 41103 12 1 08 06 04 02 0 1 05 1 0 05 0 05 05 1 1 42103 mr ml algorithms multiple linear dependency consideralinearrelationbetweenanindependentvariablexx rn andadependentrandomvariableyy r yβ β x β x β x w 0 1 1 2 2 n n wherewrepresentsarandomvariablewithmeanzeroandconstant varianceσ2 w inmatrixnotationtheequationcanbewrittenas yxtβw wherexstandsforthep1vectorx1x x x 1 2 n β β β isthevectorofparametersandpn1isthetotal 0 n numberofmodelparameters nbinthefollowingx willdenotetheithvariableofthevectorxwhile x willdenotetheithobservationofthevectorx 44103 multiple linear regression model considernobservationsd cid104xycid105i1nwhere n x 1x x generatedaccordingtothepreviousmodel i1 supposethatthefollowingmultiplelinearrelationholds yxβw whereyisthen1responsevectorxisthenpdatamatrixwhose jth columnofxcontainsreadingsonthejth regressorβ isthep1 vectorofparameters y1 1 x11 x12 x1n xt 1 β0 2 x 1 x2 1 x2 2 x2 n x 2 β β 1 yn 1 xn1 xn2 xnn xt n βn 45103 normal equations theleastsquaresestimatorβˆ minimizesthecostfunction n βˆargmincid88 xtb2 argmincid0 yxbtyxbcid1 b b i1 itcanbeshownthatitsatisfiestheleastsquaresnormalequations xtxβˆxty assumingxisoffullcolumnrankweobtain βˆxtx1xty wherethextxmatrixisasymmetricppmatrix 46103 mr distribution leastsquares solution twosettings verylargennwithnsmall distributionofthecomputationsofxtx andxty verylargenandn iterativesolutionbystochasticgradientdescent seeclassonsequentialalgorithms 47103 leastsquares summation form supposen3p2 cid34 cid35 x x 11 12 x x x xtx 11 21 31 x x x x x 21 22 12 22 32 x x 31 32 cid34 cid35 x2 x2 x2 x x x x x x 11 21 31 11 12 21 22
mr.pdf,5,31 32 x x x x x x x2 x2 x2 12 11 22 21 32 31 12 22 32 cid34 cid35 cid34 cid35 x cid104 cid105 x2 x x xtx 11 x x 11 11 12 1 1 x 11 12 x x x2 12 11 12 12 n cid88 xtx xtx i1 wherex isthe1pvectordenotingtheithrowofthematrixx 48103 leastsquares summation form analogouslyitcanbeshownthat n cid88 xty xty i1 wherey istheithvalueofthevectoryandxtyhasasizep1 49103 distributed computation xtx xty createamatrixzofsizenp1byconcatenatingxandy 1 map computationofpartialxtx foreachithrowofxcomputextx sizepp 2 reduce sumallxtx 3 map computationofpartialxty foreachithrowofxi1n computexty ofsizep1 4 reduce sumallxty 5 collect collectthereducedmatricesxtxandxtyandcomputeβˆ ina conventionalmanner 50103 considerations insteadofarowwisecomputationitispossibletoimplementa partitionwisecomputation summationformallowsalinearspeedupwiththenumberofworkers intermediateresultsofleastsquaresareusefulinothertaskstoo xtxisanestimationofthecovariancematrixifallthecolumnsofxare normalizedie zeromeanandunitvariance frequentlyusedinlinear statisticseg principalcomponentanalysislineardiscriminant analysis xtyisanestimationofthecorrelationinputoutputvectoragainin normalizedsettings frequentlyusedinlinearstatisticseg rankingof features notethatabovecomputationsarescalablewithnbutnotn 51103 speedup assessment 52103 naive bayes classifier nbclassifierhasshowninsomedomainsanaccuracycomparableto thatofneuralnetworksanddecisiontreelearning considerabinaryclassificationproblemwithninputsandarandom outputvariableythattakesvaluesinthesetc c 1 k thebayesoptimalclassifiershouldreturn cxarg max probyc x k k1k wecanusebayestheoremtorewritethisexpressionas probxyc probyc cxarg max k k k1k probx arg max probxyc probyc k k k1k 53103 naive bayes classifier howtoestimatethesetwotermswithfinitedataset probyc frequencywithwhicheachtargetclassoccursinthe k trainingset estimationofprobxyc muchharder k nbisbasedonthesimplifyingassumptionthatinputsareconditionally independentgiventhetargetvalue n cid89 cid8 cid9 probxyc probx x yc prob xyc k 1 n k j k j1 thenbclassificationisthen n cid89 cid8 cid9 c xarg max probyc prob xyc nb k j k k1k j1 54103 distributed computation naive bayes classifier letussupposethatalldataarecategorical cid8 cid9 ifinputsx arebinariestheestimationofprob xyc boilsdownto j j k thecountingofthefrequenciesoftheoccurrencesofthedifferent valuesofx foraclassc j k weneedtosumoverx 0andx 1foreachlabelc j j k oncedataarepartitioneditisenoughtocomputeasumforeachblock andthenaggregatetheresults 55103 example letusconsiderthefollowingdatasetexamplefrom5 56103 example map themapfunctioncountstheattributesandtheirassociationswiththe classificationclasses forinstancethemapofthefirstrowwillreturn sunnyno 1 hotno 1 highno 1 weakno 1 classno 1 57103 example reducer input 58103 example reducer output 59103 example conditional probability fromtheoutputofthereduceritiseasytocomputetheconditional probability forinstanceforthevariablex outlookthatcantakeasvaluessunny 1 overcastrainweobtain probx sunnyyno 3 probx sunnyyno 1 1 probyno 5 where3isthevalueofsunnynoand5isthevalueofclassno theprobabilitytableisavailableitispossibletouseittoperformnaive bayesclassificationononnewinputvectors 60103 kmeans givenk0wherekisthenumberofclustersandasetofn ndimensionalobjectsclusteringistheprocessofgroupingasetofn ndimensionalintokclustersofsimilarobjects objectsshouldbesimilartooneanotherwithinthesameclusterand dissimilartothoseinotherclusters kmeansisadistancebasedunsupervisedclusteringalgorithm kmeansclusteringhasmanyusefulapplications forexampleitcan beusedtofindagroupofconsumerswithcommonbehaviorsorto clusterdocumentsbasedonthesimilarityoftheircontents selectionofkisspecifictotheapplicationorproblemdomain thereis nomagicformulatofindit 61103 20 20 15 15 10 10
mr.pdf,6,5 5 0 0 5 5 1010 8 6 4 2 0 2 4 1010 8 6 4 2 0 2 4 62103 kmeans initiallykpointscc c arechosenasclustercentersthese 1 k arecalledclustercentroids therearemanywaystoinitializetheclustercentroidsoneofwhichis tochoosethekpointsrandomlyfromthesampleofnpoints oncethekinitialclustercentroidsarechosenwecalculatethe distancefromeverypointintheinputsettoeachofthekcentersand thenassigneachpointtothespecificclustercenterwhosedistanceis closest whenallobjectshavebeenassignedthenweagainrecalculatethe positionsofthekcentroids thesetwostepsarerepeateduntiltheclustercentroidsnolonger changeorchangeverylittle 63103 distributed computation kmeans costfunctionisagainasum k cid88 cid88 arg min cid107x c cid107 k c1ck k1xic k wherec isthesetofpointsofsize1nwhichbelongtothekthcluster k ofsize1n foraverylargenthebottleneckisthecomputationofthedistancesof thenpointstothecentroids 64103 mr computation kmeans 1 wepartitionthedatasetxofsizennandwebroadcastthesetof centroidcoordinatesofsizekn 2 wedistributethecomputationofthedistancestoanumberofparallel workers 3 amapfunctionreturnsforeachx akeyvaluepairwherethekeyisthe indexk oftheclosestcentroidandthevalueisapairx1thatwill allowtocomputethesumandnumberofobservationsineachcluster 4 areducestepreturnstheupdatedcoordinatesofeachclustercentroid byaveraging 5 byiteratingthestepsaboveweconvergetothesolution 65103 broadcast c1 c2 c1xi1 ck c1xj1 x x1 2 cc k3 x x1 2 1 1 reduce c c2 2 x xk l 11 map ckxs1 xn c2xn1 ckxt1 66103 knn classifier supposeatrainingsetisavailableandtheclassificationisrequiredfora 1nqueryvector theclassificationprocedureofaknnclassifiercanbe summarisedinthesesteps 1 computethedistancebetweenthequeryandthentrainingsamples accordingtoapredefinedmetric 2 ranktheneighboursonthebasisoftheirdistancetothequery 3 selectasubsetoftheknearestneighbors eachoftheseneighbours hasanassociatedclass 4 returntheclasswhichcharacterisesthemajorityoftheknearest neighbors 67103 distributed knn lazyalgorithm nothingisdoneuntilaqueryisdone notrainingcomputationalcost allcomputationaleffortconcernsthepredictionstep foreachquery pointneighbourshavetobeidentifiedandclassificationreturned problem comparingaquerypointwitheachsampleinahugedatabase isinfeasiblebecauseofthelinearcomplexityon curseofdimensionalitymakestheproblemstillworse howeverretrievingasetofapproximatenearestneighboursannis oftensufficient distributionofthepredictioncomputationaleffort 68103 mrknn in4theauthorsproposeamapreducebasedapproachforknearest neighbourclassification inthisapproachthetestsetofsizetnisbroadcasttoallworkers map foreachchunkofdataitcomputesthesimilaritybetweenallthe testexamplesandaportionofthetrainingset theknearest neighboursandtheircomputeddistancevalueswillbeemittedtothe reducestage reduce itdetermineswhicharethefinalknearestneighboursfromthe listprovidedbythemaps itisimplementedbymergingtwosortedlists ofsizek 69103 mrknn from4 70103 pasting random subspaces supervisedtaskforwhichthedatasetcannotresideinmemory breimanthegenialinventorofregressiontreerandomforest bagging proposedthepastingmethod1 pasting learninganensembleofmodelsindividuallybuiltonrandom subsetsofthetrainingexampleshencealleviatingthememory requirementssincethebasemodelswouldbebuiltononlysmallparts ofdataset ho2proposedtolearnanensembleofmodelsindividuallybuilton randomonrandomsubsetsoftheinputvariablesorfeatures 71103 random patches thetwoideashasbeenmergedby3intherandompatchalgorithm whichconsistsincreatinganumberofdatasetscoveringaportionof thefeaturesandaportionoftheobservationsfitthemwithamodel andcombinethepredictions theportionofthefeatureandsamplespaceiscontrolledbytwo hyperparameters highlyparallel eachpatchcanbemanagedindependentlybya processor ifthesizeofthepatchiscompatiblewiththecentralmemory conventionalmemoryarchitecturesmaybeused openchallenges subsetsofdatamaypresentdifferentstatistical propertiesthanoveralldataset forexampleconfidenceintervals basedonsubsetsofdatawillgenerallybewiderthanconfidence intervalsbasedontheoriginaldatapapersofmjordanonstatistics computationandscalability 72103 hashes anhashfunctiontakesakeyvaluedatumofanytypeasinputand returnsabucketintegernumberinarange0b1asresult aimofhashfunctionistorandomizekeysie tosendapproximatelyan equalnumberofkeystoeachbucketnumber 73103 locality sensitivity hashing supposewehaveaverylargesetofelementsandwewishtocompute thesimilarityofeverypair lshidea hasheachelementseveraltimesinsuchawaythatsimilar elementsaremorelikelytobehashedtothesamebucketthan dissimilarones anypairhashedtothesamebucketisacandidatepairforsimilarity falsepositives dissimilarelementsinthesamebucket falsenegatives trulysimilarelementsnothashingtothesamebucket lshalsoknownasnearneighboursearch 74103 lsh functions cosine distance letusconsidertwovectorsx rnx rn inandimensionalspaceand 1 2 thecosinedistance thelocalitysensitivefamilyforthecosinedistanceisasetofbbinary codesfunctionseachbuiltfromarandomlychosenvector h rnb1b b f xsignh xie f x f x ifandonlyifthedotproducts b b b 1 b 2 h x andh x havethesamesign b 1 b 2 eachndimensionalvectoristransformedinabdimensionalbinary code sincenbcodingreducesstorage andhammingdistancecan becalculatedefficientlyinabitwisemanner amodifiedversionisthesketchwhichconsistsinrestrictingtovectors h whosecomponentsare1and1 b 75103 hyperplance cosine cosinesimilarityisthecosineoftheanglebetweentwovectors fromhttpswwwpineconeiolearn localitysensitivehashingrandomprojection 76103 n2inputdimensionsb4bitsbinarycodeeachcorrespondingtoa hyperplane from8 77103 mr divide conquer incaseofmassivetrainingsetsofdimensionalitynitcouldbeeffectiveto partitionitaccordingtoalocalityprinciple bydefininganumberbofsketchvectorsh 11nitisispossibleto b projecteachtrainingpointinabdimensionalspaceandusethehashing fordefiningsetsofneighbouringpoints training 1 broadcastthesmatrixofdimensionalitynbwhereeachcolumn
mr.pdf,7,correspondstoasketchvector 2 map foreachtraininginputvectorx computethematrixproductx andstorethesignvectorashashingkey foreachtestpointq 1 computethematrixproductqsandstorethesignvector 2 filterthetrainingsetbyselectingonlythesubsetwiththesame hashing 3 makeaconventionallearningprocedurebyusingasubsetofthe trainingset 78103 learning hash lsharedataindependenthashfunctions inspiteoftheireleganttheoreticalpropertiestheirperformancehas beenshowninsufficientinmanyrealworldsettings toachievehighprecisionlonghashcodesarerequiredandsemantic proximityisnotalwaysrespectedsemanticgap learningtohash8arerecentapproacheswhichusemachine learningtoexploitdatadistributionorclasslabelstooptimizethehash function particularlyusefulinimageswherethesimilarityordistancebetween imagepairsisusuallynotdefinedviaasimplemetric 79103 ranking feature selection itassessestheimportanceorrelevanceofeachvariablewithrespect totheoutputbyusingaunivariatemeasure theyaresupervised techniquesofcomplexityon measuresofrelevancewhicharecommonlyusedare pearsoncorrelationthegreaterthemorerelevantwhichassumeslinearity mutualinformationthegreaterthemorerelevant aftertheunivariateassessmentthemethodranksthevariablesina decreasingorderofrelevance thesemethodsarefastcomplexityonandtheiroutputisintuitive andeasytounderstand atthesametimetheydisregardredundancies andhigherorderinteractionsbetweenvariableseg genes thebestkfeaturestakenindividuallydonotnecessarilyconstitutethe bestkvariatevector 80103 mr filter selection supervisedtaskwithninputfeaturesandonetarget traininginputoutputdatainarectangularformat eachrowcontains boththeinputvaluesandtheassociatedoutput map key featureindex value paircomposedofthefeaturevalueandthecorrespondingtargetvalue reduce thetupleswiththesamekeyreferringtothesamefeatureare groupedandthebivariatescoreeg correlationormutualinformation computed theoutputisavectorofsizencontainingtheassociationscoreofeach inputfeatures formoreadvancedstrategieslookat7 81103 1 2 1 2 1 2 1 1 2 1 2 1 2 0 1 1 2 1 2 1 2 0 1 1 2 1 2 0 1 2 1 2 0 1 1 2 1 2 0 2 0 0 1 2 1 2 0 1 1 2 1 2 0 2 0 0 1 2 1 1 2 1 2 0 1 1 2 1 2 0 2 0 0 1 2 1 2 2 1 1 2 1 2 0 1 1 2 1 1 2 1 2 0 1 2 0 1 2 1 2 0 0 2 0 1 2 0 0 1 2 1 2 2 1 2 2 1 1 2 1 2 0 1 1 2 1 1 2 1 2 0 1 mi 1 1 2 0 1 2 1 2 0 0 2 0 1 2 0 0 2 mi 2 1 2 1 2 2 1 2 2 1 homework considerabigrectangularmatrix 11 12 1n 21 22 2n n1 n2 nn writeamapreducepseudocodetotransposethematrix notethat apseudocodedescriptionofthemapandreducefunctionsare required youcanusedrawingsandtexttoillustrateanddocumentyourcode 92103 solution reduce rank 11 m11 1n mn1 12m21 1 m11 m21 mn1 1 m11 m12 m1n 11 m11 21 m12 n1m1n 23 m13 22 m22 2nmn2 2 m12 m22 mn2 2 m21 m22 m2n p 12 m21 22 m22 n2m2n n m1n m2n mnn n mn1 mn2 mnn 1n mn1 2n mn2
