file_name,chunk_id,text
6-parallel.pdf,8,ppuelacs thegustafsonbarsislawisaformulathatgivesthetheoreticalscaleupthatcanbe expectedofasystemwhoseresourcesareimproved gustafsonbarsislaw gustafsonbarsisslaw 95 scaleupp1ααp 90 75 50 pdenotesthenumberofparallel processors αdenotesthefractionofthetaskthat benefitsfromparallelism 1αdenotesthefractionofthetaskthat runsinherentlysequential inotherwords anembarrasinglyparallelproblemisaproblemwhereα100iethereis littleornoinherentsequentialcomputationinvolvedeg countoccurrencesof belgium inotherwords whenphrasedasabspalgorithmthenumberofsuperstepssisfixeddoes notdependonproblemsizeandthetotalworkwandtotalcommunicationh areinverselyproportionaltothenumberofprocessorsp embarassing parallelism definition parallel computing embarrassinglyparallel workload problem also calledperfectlyparallelorpleasinglyparallelisonewherelittleornoeffortis neededtoseparatetheproblemintoanumberofparalleltasks thisisoftenthecasewherethereislittleornodependencyorneedforcom municationbetweenthoseparalleltasksorforresultsbetweenthem wikipedia 40 inotherwords whenphrasedasabspalgorithmthenumberofsuperstepssisfixeddoes notdependonproblemsizeandthetotalworkwandtotalcommunicationh areinverselyproportionaltothenumberofprocessorsp embarassing parallelism definition parallel computing embarrassinglyparallel workload problem also calledperfectlyparallelorpleasinglyparallelisonewherelittleornoeffortis neededtoseparatetheproblemintoanumberofparalleltasks thisisoftenthecasewherethereislittleornodependencyorneedforcom municationbetweenthoseparalleltasksorforresultsbetweenthem wikipedia inotherwords anembarrasinglyparallelproblemisaproblemwhereα100iethereis littleornoinherentsequentialcomputationinvolvedeg countoccurrencesof belgium 40 embarassing parallelism definition parallel computing embarrassinglyparallel workload problem also calledperfectlyparallelorpleasinglyparallelisonewherelittleornoeffortis neededtoseparatetheproblemintoanumberofparalleltasks thisisoftenthecasewherethereislittleornodependencyorneedforcom municationbetweenthoseparalleltasksorforresultsbetweenthem wikipedia inotherwords anembarrasinglyparallelproblemisaproblemwhereα100iethereis littleornoinherentsequentialcomputationinvolvedeg countoccurrencesof belgium inotherwords whenphrasedasabspalgorithmthenumberofsuperstepssisfixeddoes notdependonproblemsizeandthetotalworkwandtotalcommunicationh areinverselyproportionaltothenumberofprocessorsp 40 problems problemsongraphsaretypicalexamplesofproblemswhereparallelism canhelpbutwhicharenotembarassinglyparallel 41 scalability cost believe could say nobody ever got fired using hadoop cluster norm data analytics run commodityclusterswithprogrammingframeworkssuchas mr spark rowstron et al hotcdp 2012 43 norm data analytics run commodityclusterswithprogrammingframeworkssuchas mr spark believe could say nobody ever got fired using hadoop cluster rowstron et al hotcdp 2012 43 costbenefitanalysisrequired butrunningcomputationonarented clustercostsmoney nobodylikestheirawsazuregcp bill didyoureallyneedthis infrastructureforyourcomputation caseinpoint graphanalyticsnext word caution runninghadoopsparkisregarded asthecoolthingtodo clustersasaservicehasbecome extremelyeasy 44 caseinpoint graphanalyticsnext word caution runninghadoopsparkisregarded asthecoolthingtodo clustersasaservicehasbecome extremelyeasy costbenefitanalysisrequired butrunningcomputationonarented clustercostsmoney nobodylikestheirawsazuregcp bill didyoureallyneedthis infrastructureforyourcomputation 44 word caution runninghadoopsparkisregarded asthecoolthingtodo clustersasaservicehasbecome extremelyeasy costbenefitanalysisrequired butrunningcomputationonarented clustercostsmoney nobodylikestheirawsazuregcp bill didyoureallyneedthis infrastructureforyourcomputation caseinpoint graphanalyticsnext 44 quiz speedupofadataparallelalgorithmbeforeaandafterbachangewasmade tothealgorithm whichsystemwouldyouprefer figuresourcemcsherryetalscalabilitybutatwhatcosthotosworkshop2015 45 bottomline speedupandscaleupdontmeananythingiftheyarebecauseofsystem inefficienciesoverheadsthatareparallelizable speedup isnt everything speedupandtotalruntimeofadataparallelalgorithmbeforeaandafterba changewasmadetothealgorithm whichsystemwouldyouprefer figuresourcemcsherryetalscalabilitybutatwhatcosthotosworkshop2015 46 speedup isnt everything speedupandtotalruntimeofadataparallelalgorithmbeforeaandafterba changewasmadetothealgorithm whichsystemwouldyouprefer bottomline speedupandscaleupdontmeananythingiftheyarebecauseofsystem inefficienciesoverheadsthatareparallelizable figuresourcemcsherryetalscalabilitybutatwhatcosthotosworkshop2015 46 reportedelapsedtimesfor20pagerankiterations reportedelapsedtimesforconnectedcomponents comparedtoanimprovedsinglethreadedimple rbeapsoerdteodnellaabpeslepdrtoipmaegsatfioorn20copmagpearraendktoitearastiniognles mentationtraversingedgesindifferentorder cthormeapdaereddimtopalesminegnlteattihorneandoetduimsinpglelmabeenltaptrioopnaga tion parallelism isnt everything twographdatasets frommcsherryetalscalabilitybutatwhatcosthotosworkshop2015 47 reportedelapsedtimesfor20pagerankiterations reportedelapsedtimesforconnectedcomponents comparedtoanimprovedsinglethreadedimple basedonlabelpropagationcomparedtoasingle mentationtraversingedgesindifferentorder threadedimplementationnotusinglabelpropaga tion parallelism isnt everything twographdatasets reportedelapsedtimesfor20pagerankiterations comparedtoasinglethreadedimplementation frommcsherryetalscalabilitybutatwhatcosthotosworkshop2015 47 reportedelapsedtimesforconnectedcomponents rbeapsoerdteodnellaabpeslepdrtoipmaegsatfioorn20copmagpearraendktoitearastiniognles cthormeapdaereddimtopalesminegnlteattihorneandoetduimsinpglelmabeenltaptrioopnaga tion parallelism isnt everything twographdatasets reportedelapsedtimesfor20pagerankiterations comparedtoanimprovedsinglethreadedimple mentationtraversingedgesindifferentorder frommcsherryetalscalabilitybutatwhatcosthotosworkshop2015 47 reportedelapsedtimesfor20pagerankiterations comparedtoanimprovedsinglethreadedimple reportedelapsedtimesfor20pagerankiterations mentationtraversingedgesindifferentorder comparedtoasinglethreadedimplementation parallelism isnt everything twographdatasets reportedelapsedtimesforconnectedcomponents basedonlabelpropagationcomparedtoasingle threadedimplementationnotusinglabelpropaga tion frommcsherryetalscalabilitybutatwhatcosthotosworkshop2015 47 cost definition definethecostofasystemonagiven workloaddatasettobetheconfiguration atwhichitoutperformsasinglethreaded optimizedalgorithm thecosthencequantifieswhenitbecomesusefultouseadistributedprocessing systemforagivenworkload ifthecostishighasinglethreadedimplementationmayactuallybemore preferablefromaneconomicviewpoint somesystemshaveunboundedcostoncertaingraphrelatedproblems checkoutthefulltalkaboutthecostpaperat httpswwwyoutubecomwatchv6bwbejbmng0 48 conclusion bigdataprogrammingframeworkssuchasmrandsparkcanallowanalysisofhuge datasets theseframeworksintroducetheirownoverheadsavoidnetworkcommunicationif possible thebspmodelisnaturaltheoreticalmodelfortheformulationandanalysisof distributedparallelalgorithms therearelimitstospeedupscaleupismorefavorable bigdataprogrammingframworksaregreatforembarassinglyparallelproblems forproblemsthataremoredifficulttoparallelizeeggraphproblemsitmaynotalways makesensetousedistributedprocessingagoodcentralalgorithmcangoalongway 49 references robhbisseling
6-parallel.pdf,9,parallelscientificcomputation astructuredapproachusing bspandmpioxforduniversitypressmarch2004 peterzecevićandmarkobonaći sparkinactionmanning2017 leslievaliant abridgingmodelforparallelcomputationcommunicationsof theacm3381990 malewiczetal pregel asystemforlargescalegraphprocessingsigmod conference2010 frankmcsherrymichaelisardderekgmurray scalability butatwhatcost hotosworkshop2015 50 questions 51 acknowledgements basedoncontentcreatedbystijnvansummeren 52
9780521192248_excerpt.pdf,0,cambridge university press 9780521192248 scaling machine learning parallel distributed approaches edited ron bekkerman mikhail bilenko john langford excerpt information chapter 1 scaling machine learning introduction ron bekkerman mikhail bilenko john langford distributedandparallelprocessingofverylargedatasetshasbeenemployedfordecades inspecializedhighbudgetsettingssuchasfinancialandpetroleumindustryapplica tionsrecentyearshavebroughtdramaticprogressinusabilitycosteffectivenessand diversityofparallelcomputingplatformswiththeirpopularitygrowingforabroadset ofdataanalysisandmachinelearningtasks current rise interest scaling machine learning applications partiallyattributedtotheevolutionofhardwarearchitecturesandprogrammingframe worksthatmakeiteasytoexploitthetypesofparallelismrealizableinmanylearning algorithms number platforms make convenient implement concurrent pro cessingofdatainstancesortheirfeaturesthisallowsfairlystraightforwardparalleliza tion many learning algorithms view input unordered batch examples andaggregateisolatedcomputationsovereachofthem increasedattentiontolargescalemachinelearningisalsoduetothespreadofvery largedatasetsacrossmanymodernapplicationssuchdatasetsareoftenaccumulated distributed storage platforms motivating development learning algorithms thatcanbedistributedappropriatelyfinallytheproliferationofsensingdevicesthat perform realtime inference based highdimensional complex feature representa tionsdrivesadditionaldemandforutilizingparallelisminlearningcentricapplications examplesofthistrendincludespeechrecognitionandvisualobjectdetectionbecoming commonplaceinautonomousrobotsandmobiledevices theabundanceofdistributedplatformchoicesprovidesanumberofoptionsforim plementingmachinelearningalgorithmstoobtainefficiencygainsorthecapabilityto processverylargedatasetstheseoptionsincludecustomizableintegratedcircuitseg fieldprogrammable gate arrays fpgas custom processing units eg general purposegraphicsprocessingunitsgpusmultiprocessorandmulticoreparallelism highperformance computing hpc clusters connected fast local networks datacenterscalevirtualclustersthatcanberentedfromcommercialcloudcomputing providersasidefromthemultipleplatformoptionsthereexistsavarietyofprogram ming frameworks algorithms implemented framework choices tend 1 web service cambridge university press wwwcambridgeorg cambridge university press 9780521192248 scaling machine learning parallel distributed approaches edited ron bekkerman mikhail bilenko john langford excerpt information 2 1 scalingupmachinelearningintroduction particularly diverse distributed architectures clusters commodity pcs wide range platforms frameworks parallel distributed comput ing presents opportunities challenges machine learning scientists engineers fully exploiting available hardware resources requires adapting algorithms redesigning others enable concurrent execution pre diction model learning algorithm structure dataflow underlying task decomposition must taken account determine suitability particular infrastructurechoice chaptersmakingupthisvolumeformarepresentativesetofstateoftheartsolutions span space modern parallel computing platforms frameworks varietyofmachinelearningalgorithmstasksandapplicationsalthoughitisinfeasible cover every existing approach every platform believe presented set techniques covers commonly used methods including popular top performers eg boosted decision trees support vector machines common baselinesegkmeansclustering becausemostchaptersfocusonasinglechoiceofplatformandorframeworkthe rest introduction provides reader unifying context brief overview ofmachinelearningbasicsandfundamentalconceptsinparallelanddistributedcom puting summary typical task application scenarios require scaling learning thoughts evaluating algorithm performance platform tradeoffs followingtheseareanoverviewofthechaptersandbibliographynotes 11 machinelearningbasics machine learning focuses constructing algorithms making predictions data machine learning task aims identify learn function fx maps input domain x data onto output domain possible predictions function f isselectedfromacertainfunctionclasswhichisdifferentforeachfamily learning algorithms elements x applicationspecific representations ofdataobjectsandpredictionsrespectively twocanonicalmachinelearningsettingsaresupervisedlearningandunsupervised learningsupervisedlearningalgorithmsutilizetrainingdatatoconstructaprediction function fwhichissubsequentlyappliedtotest
9780521192248_excerpt.pdf,1,instancestypicallytrainingdatais provided form labeled examples xyx x data instance andyisthecorrespondinggroundtruthpredictionforx ultimate goal supervised learning identify function f produces accuratepredictionsontestdatamoreformallythegoalistominimizetheprediction errorlossfunctionl rwhichquantifiesthedifferencebetweenany fx andythepredictedoutputofx anditsgroundtruthlabelhoweverthelosscannot minimized directly test instances labels typically unavailable training time instead supervised learning algorithms aim construct predictive functions generalize well previously unseen data opposed performingoptimallyjustonthegiventrainingsetthatisoverfittingthetrainingdata themostcommonsupervisedlearningsettingisinductionwhereitisassumedthat eachtrainingandtestexamplexyissampledfromsomeunknownjointprobability web service cambridge university press wwwcambridgeorg cambridge university press 9780521192248 scaling machine learning parallel distributed approaches edited ron bekkerman mikhail bilenko john langford excerpt information 12 reasonsforscalingupmachinelearning 3 distribution p x objective find f minimizes expected loss e xyp lfxybecausethejointdistributionpisunknownexpectedlosscannot minimized closed form hence learning algorithms approximate based training examples additional supervised learning settings include semisupervised learning input data consists labeled unlabeled instances transferlearningandonlinelearningseesection163 twoclassicsupervisedlearningtasksareclassificationandregressioninclassifica tiontheoutputdomainisafinitediscretesetofcategoriesclassesy c c 1 k whereas regression output domain set real numbers r complex output domains explored within advanced learning frameworks structuredlearningbakiretal2007 simplest classification scenario binary two classes let us consider small example assume task learn function predicts whetheranincomingemailmessageisspamornotacommonwaytorepresenttextual messagesisaslargesparsevectorsinwhicheveryentrycorrespondstoavocabulary wordandnonzeroentriesrepresentwordsthatarepresentinthemessagethelabel represented 1 spam 1 nonspam thiscid2cid3represencid4tation common learn vector weights w optimizing fxsign wx predictthelabel prominent example unsupervised learning data clustering clus tering goal construct function f partitions unlabeled dataset k yclusterswithy beingthesetofclusterindicesdatainstancesassignedtothe cluster presumably similar data instances assigned cluster many ways define similarity data instancesforexampleforvectordatainvertedeuclideandistanceandcosinesimi larityarecommonlyusedclusteringqualityisoftenmeasuredagainstadatasetwith existingclasslabelsthatarewithheldduringclusteringaqualitymeasurepenalizes f ifitassignsinstancesofthesameclasstodifferentclustersandinstancesofdifferent classestothesamecluster wenotethatbothsupervisedandunsupervisedlearningsettingsdistinguishbetween learning inference tasks learning refers process identifying prediction function f inference refers computing fx data instance x many learning algorithms inference component learning process predictions interim candidate fcid3 training data used search optimal f depending application domain scaling may required either learning inference algorithm chapters book present numerousexamplesofspeedingupboth 12 reasonsforscalingupmachinelearning number settings practitioner could find scale chine learning task daunting singlemachine processing consider employing parallelizationsuchsettingsarecharacterizedby 1 largenumberofdatainstancesinmanydomainsthenumberofpotentialtraining examplesisextremelylargemakingsinglemachineprocessinginfeasible web service cambridge university press wwwcambridgeorg cambridge university press 9780521192248 scaling machine learning parallel distributed approaches edited ron bekkerman mikhail bilenko john langford excerpt
9780521192248_excerpt.pdf,2,information 4 1 scalingupmachinelearningintroduction 2 highinputdimensionalityinsomeapplicationsdatainstancesarerepresentedbya verylargenumberoffeaturesmachinelearningalgorithmsmaypartitioncomputation acrossthesetoffeatureswhichallowsscalinguptolengthydatarepresentations 3 model algorithm complexity number highaccuracy learning algorithms eitherrelyoncomplexnonlinearmodelsoremploycomputationallyexpensivesubrou tines cases distributing computation across multiple processing units bethekeyenablerforlearningonlargedatasets 4 inferencetimeconstraintsapplicationsthatinvolvesensingsuchasrobotnavigation orspeechrecognitionrequirepredictionstobemadeinrealtimetightconstraintson inferencespeedinsuchsettingsinviteparallelizationofinferencealgorithms 5 prediction cascades applications require sequential interdependent predictions havehighlycomplexjointoutputspacesandparallelizationcansignificantlyspeedup inferenceinsuchsettings 6 model selection parameter sweeps tuning hyperparameters learning algo rithmsandstatisticalsignificanceevaluationrequiremultipleexecutionsoflearningand inferencefortunatelytheseproceduresbelongtothecategoryofsocalledembarrass inglyparallelizableapplicationsnaturallysuitedforconcurrentexecution thefollowingsectionsdiscusseachofthesescenariosinmoredetail 121 largenumberofdatainstances datasets thataggregatebillions eventsperday havebecomecommon inanumber domains internet finance event potential input learningalgorithmalsomoreandmoredevicesincludesensorscontinuouslylogging observationsthatcanserveastrainingdataeachdatainstancemayhaveforexample thousandsofnonzerofeaturesonaverageresultingindatasetsof1012instancefeature pairs per day even feature takes 1 byte store datasets collected timecaneasilyreachhundredsofterabytes thepreferredwaytoeffectivelyprocesssuchdatasetsistocombinethedistributed storage bandwidth cluster machines several computational frameworks haverecentlyemergedtoeasetheuseoflargequantitiesofdatasuchasmapreduce anddryadlinqusedinseveralchaptersinthisbooksuchframeworkscombinethe ability use highcapacity storage execution platforms programming via simplenaturallyparallelizablelanguageprimitives 122 highinputdimensionality machinelearninganddataminingtasksinvolvingnaturallanguageimagesorvideo easily input dimensionality 106 higher far exceeding comfortable scaleof101000featuresconsideredcommonuntilrecentlyalthoughdatainsome domains sparse always case sparsity also lost parameterspaceofmanyalgorithmsparallelizingthecomputationacrossfeaturescan thusbeanattractivepathwayforscalingupcomputationtoricherrepresentations speeding algorithms naturally iterate features decision trees web service cambridge university press wwwcambridgeorg cambridge university press 9780521192248 scaling machine learning parallel distributed approaches edited ron bekkerman mikhail bilenko john langford excerpt information 12 reasonsforscalingupmachinelearning 5 123 modelandalgorithmcomplexity datainsomedomainshasinherentlynonlinearstructurewithrespecttothebasicfea turesegpixelsorwordsmodelsthatemployhighlynonlinearrepresentationssuch asdecisiontreeensemblesormultilayerdeepnetworkscansignificantlyoutperform simpler algorithms applications although feature engineering yield high accuracieswithcomputationallycheaplinearmodelsinthesedomainsthereisagrow ing interest learning automatically possible base representation commoncharacteristicofalgorithmsthatattemptthisistheirsubstantialcomputational complexityalthoughthetrainingdatamayeasilyfitononemachinethelearningpro cessmaysimplybetooslowforareasonabledevelopmentcyclethisisalsothecase forsomelearningalgorithmsthecomputationalcomplexityofwhichissuperlinearin thenumberoftrainingexamples forproblemsofthisnatureparallelmultinodeormulticoreimplementationsappear viableandhavebeenemployedsuccessfullyallowingtheuseofcomplexalgorithms andmodelsforlargerdatasetsinadditioncoprocessorssuchasgpushavealsobeen employedsuccessfullyforfasttransformationoftheoriginalinputspace 124 inferencetimeconstraints theprimarymeansforreducingthetestingtimeisviaembarrassinglyparallelreplica tionthisapproachworkswellforsettingswherethroughputistheprimaryconcern thenumberofevaluationstobedoneisverylargeconsiderforexampleevaluating 1010emailsperdayinaspamfilterwhichisnotexpectedtooutputresultsinrealtime yetmustnotbecomebacklogged inference latency generally stringent concern compared throughput latency issues arise situation systems waiting prediction overall application performance degrades rapidly latency instance occursforacardrivingrobotmakingpathplanningdecisionsbasedonseveralsensors oranonlinenewsproviderthataimstoimproveuserexperiencebyselectingsuggested storiesusingontheflypersonalization constraints throughput latency entirely compatible example data pipelining trades throughput latency however utilizing highly parallelized hardware architectures gpus fpgas found effective 125 predictioncascades many realworld problems object tracking speech recognition machine translationrequireperformingasequenceofinterdependentpredictionsformingpre diction cascades cascade viewed single inference task large joint output space typically resulting high computational costs due creasedcomputationalcomplexityinterdependenciesbetweenthepredictiontasksare typicallytackledbystagewiseparallelizationofindividualtasksalongwithadaptive taskmanagementasillustratedbytheapproachofchapter21tospeechrecognition web service cambridge university press wwwcambridgeorg cambridge university press 9780521192248 scaling machine learning parallel distributed approaches edited ron bekkerman mikhail bilenko john langford excerpt information 6 1 scalingupmachinelearningintroduction 126 modelselectionandparametersweeps thepracticeofdevelopingtuningandevaluatinglearningalgorithmsreliesonwork
