file_name,chunk_id,text
Gama_ACMCS_AdaptationCD_accepted.pdf,4,l t1 figure 3 depicts generic schema online adaptive learning algorithm nutshellthememorymoduledefineshowandwhichdataispresentedtothelearning algorithmlearningmodulethelossestimationmoduletrackstheperformanceofthe learning algorithm sends information change detection module update themodelifnecessarysection3willdiscussthefourmodulesofthesystemmemory learningchangedetectionlossestimationindetail setting variations instance true values target vari ablefeedbackcomewithadelayorarenotavailableatallmoreovernewexamples prediction may arrive get feedback data already acmcomputingsurveysvol1no1article1publicationdatejanuary2013 asurveyonconceptdriftadaptation 17 input system output 1memory 1 data learning prediction 3 prediction part feedback 2 2 3 3 diagnostic delay part loss change alarm estimation 2 detection 2 1 predict mandatory 2 diagnose optional 3 update fig3 agenericschemaforanonlineadaptivelearningalgorithm processed case model update would delayed principles oper ation remain finally settings may need process examples batchesratherthanonebyone 25 illustrativeapplications problem concept drift recognized addressed multiple domains application areas including medicine kukar 2003 tsymbal et al 2006 indus try pechenizkiy et al 2009 education castillo et al 2003 business klinken berg2003applicationsrequiringadaptationcanbegroupedintofourcategories monitoringandcontrol category includes detection anomalous behavior adversaryactivitiesonthewebcomputernetworkstelecommunicationsfinancial transactions application areas abnormal behavior needs signaledanditisoftenformulatedasadetectiontask managementandstrategicplanning category includes predictive analytics tasks evaluation creditworthiness demand prediction food sales bus traveltimepredictioncrimepredictionbyregion personalassistanceandinformation category includes recommender systems categorization organization textual information customer profiling mar ketingpersonalmailcategorizationandspamfiltering ubiquitousenvironmentapplications thiscategoryincludesawidespectrumofmov ing stationary systems interact changing environments stancemovingrobotsmobilevehiclessmarthouseholdappliances next discuss motivating application cases within category illustrate demandofadaptivelearningsystemsthatcanhandleconceptdrift 251 monitoringandcontrol monitoring control applications data often pre sented form time series two typical learning tasks timeseries fore castingregressiontaskoranomalydetectionclassificationtask onlinemassflowpredictioninanindustrialboilerpechenizkiyetal2009isanex ample applicationin themonitoring andcontrol categorymass flow predictionwould helptoimproveoperationandcontroloftheboilerinsteadyoperationcombustionis affectedbythedisturbancesinthefeedrateofthefuelandbytheincompletemixingof thefuelinthebedknowingthemassflowisimportantforboilercontrolthesystem takes fuel continuously mixed inside transferred container boiler scaling sensors located container provide streaming data task istopredictestimatethemassflowinrealtime concept drift happens due following reasons fuel feeding manual non standardized process necessarily smooth short inter acmcomputingsurveysvol1no1article1publicationdatejanuary2013 18 jgamaetal ruptionseachoperatorcanhavedifferenthabitstheprocesscharacteristicsmayde pendonthetypeandthequalityoffuelusedthemainfocusforanadaptivelearning algorithm handle two types changes abrupt change feeding slower butstillabruptswitchtoburningonechallengeforlearningisthatthefeedbackthe ground truth mass flow available approximately esti mated retrospectively inspecting historical data additional challenge dealwithspecificonesidedoutliersthatcanbeeasilymistakenforchanges traditionalapproachessuchasadwinseesection323forexplicitchangedetec tionbasedonthemonitoringoftherawsensorsignalorstreamingerroroftheregres sorsgivereasonableresultstheycanbeimprovedbyconsideringthepeculiaritiesof theapplication 252 managementandstrategicplanning thesmartgridsgisanelectricsystemthat usestwowaydigitalinformationcybersecurecommunicationtechnologiesandcom putational intelligence integrated fashion across heterogeneous distributed electricity generation transmission distribution consumption achieve
Gama_ACMCS_AdaptationCD_accepted.pdf,5,energy efficiency key novel characteristic sgs intelligent layer analyzes thedataproducedbysmartmetersallowingcompaniestodeveloppowerfulnewcapa bilities terms grid management planning customer services energy effi ciencytheadventofsgshaschangedthewayenergyisproducedpricedandbilled key aspect sgs distributed energy production namely renewable energies penetration renewable energies solar wind etc increasing fast power forecastingbecomesanimportantfactorindefiningtheoperationplanningpoliciesto beadoptedbyatransmissionsystemoperator observing literature wind power prediction monteiro et al 2009 one realizes proposals based offline training mode building static model used produce predictions option rely assump tions stationarity wind electric power model must strongly ques tioned bremnes 2004 bessa et al 2009 using real data three distinct wind parksbessaetal2009presentsthemeritsofonlinetrainingagainstofflinetrain ing neural networks authors point evolving nature data presenceofconceptdriftinwindpatternbehavior 253 personalassistanceandinformation textclassificationhasbeenapopulartopicin machinelearningfordecadeshoweverinterestingapplicationsrelatedtotheproblem concept drift appeared relatively recently examples text stream applications cludeemailclassificationcarmonacejudoetal2010emailspamdetectionlind strometal2010andsentimentclassificationbifetandfrank2010sentimentclas sificationisapopulartaskinsocialmediamonitoringcustomerfeedbackanalysisand otherapplications themainsourceofconceptdriftinemailclassificationandspamfilteringaredueto changingemailcontentandpresentationvirtualdriftaswellasadaptivebehaviour spammers trying overcome spam filters may virtual real besides users maychangetheirattitudetowardsparticularcategoriesofemailsstartingorstopping consider spam real drift sentiment classification vocabulary used express positive negative sentiments may change time since collection documentsis staticvirtual drift noveltiesthe feature space representing currentcollectionisdynamicthatmayrequirespecificupdatesofthemodels variousadaptivelearningstrategieshavebeenusedinthisdomainincludingindi vidual methods like casebased reasoning ensembles either evolving explicitdetectionofchangesbymeansofchangedetectorssection32 availability feedback serious challenge personal assistance informa tion dilemma feedback easily available implies need au acmcomputingsurveysvol1no1article1publicationdatejanuary2013 asurveyonconceptdriftadaptation 19 tomated predictions email classification hope time time willreceivefeedbackfromtheuserincaseofmisclassificationsorcandesignanactive learningsystemegzliobaiteetal2013which fromtimetotimeaskstheuserto providelabelsondemandhoweverwhenpossibleweneedtoaimatautomaticways forobtainingthetruelabels suppose monitoring attitude people towards political party want classify polarity sentiment tweets twitter labelling tweets manually positive negative laborious expensive task however tweets may authorprovidedsentimentindicatorschangingsentimentisimplicitintheuseofvar ious types emoticons hence may use label training data smileys emoticons visual cues associated emotional states con structed using characters available standard keyboard representing facial expression emotion using emoticons authors tweets annotate text withanemotionalstateannotatedtweetscanbeusedtotrainasentimentclassifier buildingacontentbasedfilterforadaptivenewsaccesspresentratherdifferentper spectiveontextclassificationinstreamingsettingsthegoalistolearnincrementally keep date user model news story classification simple yet effective approach proposed billsus pazzani 2000 user adap tivelearningsystemisbuiltconsistingofasimpleensemblewithseparatemodelsfor shorttermandlongterminterestsofusersastablenaivebayesclassifierisusedfor modelling long term interests user nearest neighbour classifier cap tures short term interests user shortterm interests model fixed size window liked news stories maintained andor instances weighed withrespecttotheiragenoexplicitchangedetectionisusedformonitoringeitherof
Gama_ACMCS_AdaptationCD_accepted.pdf,6,shortterm longterm interests true labels instances come naturally due positive relevance feedback ie user accessing particular news itemprovidesthesignalthattheitemisrelevanttohisorherinterests ontheotherhandrecommendersystemsisabroadapplicationinthepersonalas sistance information category bobadilla et al 2013 adomavicius tuzhilin 2005interestsofthedataminingcommunityinrecommendersystemsdomainhave boosted netflix competition3 one lessons learnt winning teams taking temporal dynamics account substantially contributes wards building accurate models modelling user interests handling concept drift interesting aspects collaborative filtering modelling user inter ests relies primarily availability ratings already provide users realistic application case data highly imbalanced movies popular movies users rate many movies many rate rating matrix highdimensional extremely sparse containing 1 nonzero elements properties make application supervised learning techniques inapplicable motivate development advanced collaborative filtering approaches sources nature change canbediversebothitemsandusersarechangingovertimetheitemsideeffectsin cludefirstofallchangingproductperceptionandpopularitypopularityofsomemovies expected follow seasonal patterns userside effects include changing tastes andpreferencesofuserssomeofwhichmaybeshorttermorcontextualandtherefore likelyreoccurringmoodactivitycompanychangingperceptionofratingscalepossi blechangeofraterwithinhouseholdandalikeproblemsthewinningteamdeveloped ensemble approach including multiple models handling various kinds changes suggested koren 2010 popular windowing instance weighing ap proaches handling concept drift best choice kind changing 3wwwnetflixprizecom acmcomputingsurveysvol1no1article1publicationdatejanuary2013 110 jgamaetal behaviour simply collaborative filtering eg relations ratings isofthemainimportanceforpredictivemodelling 254 ubiquitousenvironmentapplications autonomous vehicle control application case ubiquitous environment category darpa grand challenge prize competition open teams developing fully autonomous driverless vehicles stanley thecarofthewinningteamofthesecondlongdistancecompetition4organizedin2005 highly reliable system board allowed car drive different offroad environments relatively high speeds among intelligent components systems stanley perform identification avoidance obstacles roadfindingthrunetal2006 stanley team combined several ideas automated terrain labelling using streaming laser sensor data short medium range obstacle avoidance streamingdatafromthecolourcameratolearntheconceptofthedrivablesurfaceand use velocity control surface ahead nondrivable car slowdownthatisthevisionmodulehadtomaintainanaccurateclassifierforiden tifying drivable nondrivable regions image stream adaptive learning approach necessary performing task reliably many changing andnoteasilymeasurablefactorssuchassurfacemateriallightingconditionsordust ordirtonthecameraitselfthateffectthetargetconcept classification task model colour drivable terrain stan ley team used adaptive mixture gaussians model adapt slowly changing lighting conditions abruptly changing surface colours eg moving paved unpaved road gradual adaptation internal gaussian adjusted rapid adaptation gaussians replaced new ones requiredspeedofadaptationdependedontheroadconditions realworld application cases present evidence adaptive learning makes itpossibletoaddresscomplexlearningproblemswhichwouldnotbefeasibletotackle stationary
Gama_ACMCS_AdaptationCD_accepted.pdf,7,settings examples also illustrate important first understandthenatureandsourceofdriftandonlythenengineeraneffectiveadaptive learningstrategy 3 taxonomyofmethodsforconceptdriftadaptation section propose new taxonomy adaptive algorithms learn pre dictivemodelfromevolvingdatawithunknowndynamicsthetwomainabstractcon cepts memory forgetting data andor models discuss set representa tive popular algorithms implement adaptation strategies discussion organizedaroundfourmodulesofadaptivelearningalgorithmsthatwereidentifiedin figure 3 memory change detection learning loss estimation main idea hindpresentingthetaxonomyinfourseparatemodulesratherthanatreeofmethods istoseeadaptivelearningsystemsasconsistingofmodularcomponentswhichcanbe permutedandcombinedwitheachotheranoverviewofthetaxonomyispresentedin figure 4 methods within module detailed figures 5 6 7 and8 31 memory learning concept drift requires update predictive model new information also forget old information consider two types mem ory short term memory represented data long term memory represented generalizationofdatamodelsinthissubsectionweanalyzetheshorttermmemory 4httparchivedarpamilgrandchallenge05 acmcomputingsurveysvol1no1article1publicationdatejanuary2013 asurveyonconceptdriftadaptation 111 data management memory forgetting mechanism changedetection detectionmodels lleeaarrnniinnggmmooddee learning aaddaappttiioonnmmeetthhooddss mmooddeellmmaannaaggeemmeenntt lossestimation estimationmethods fig4 fourmodulesofadaptivelearningsystemswithataxonomyofmethods singleexample data management multipleexamples fixedsize windows variablesize fixedsize temporalsequence abruptforgetting forgetting window variablesize mechanism sampling gradualforgetting selection yromem fig5 taxonomyofmemorypropertiesofmethods two dimensions illustrated figure 5 data management specifies dataisusedforlearningandiiforgettingmechanismspecifiesinwhichwayolddata isdiscardedtheissuesoflongtermmemorywillbediscussedinsection33 311 data management assumption behind adaptive learning algo rithmsisthatthemostrecentdataisthemostinformativeforthecurrentprediction hencedatamanagementtypicallyaimsatlearningfromthemostrecentdataeither asingleexampleormultipleexamples single example storing single example memory roots online learning algorithms learn one example time access previous examples later online algorithm process input example exampleintheorderofarrivalwithoutkeepingtheentiretrainingdatasetinmemory online learners maintain single hypothesis originate com plex predictive model model updates errordriven new example x arrives prediction yˆ made current hypothesis true target value received loss computed current hypothesis updated necessary example algorithms winnow littlestone 1987 linear classi fiersystemthatusesamultiplicativeweightupdateschemethekeycharacteristicof winnowisitsrobustnesstoirrelevantfeatures online learning algorithms seen naturally adaptive evolving distribu tions mainly due learning mechanisms continuously update model withthemostrecentexampleshoweveronlinelearningsystemsdonothaveexplicit forgetting mechanisms adaptation happens old concepts diluted due new incoming data systems like winnow littlestone 1987 vfdt domin gos hulten 2000 adapt slow changes time main limitation acmcomputingsurveysvol1no1article1publicationdatejanuary2013 112 jgamaetal slow adaptation abrupt changes depends sensible model update new example set setting parameters requires tradeoff stability sensitivity carpenter et al 1991b representative single stancememorysystemsthatexplicitlydealwithconceptdriftincludestaggerschlim mer granger 1986 dwm kolter maloof 2003 2007 svm syed et al 1999 ifcsbouchachia2011aandgt2fcbouchachiaandvanaret2013
Gama_ACMCS_AdaptationCD_accepted.pdf,8,multiple examples another approach data management maintain predictive model consistent set recent examples algorithm family flora widmer kubat 1996 one first supervised incremental learning systems evolving data original flora algorithm uses sliding window fixed length stores recent examples firstinfirstout fifo data structure time step learning algorithm builds new model using theexamplesfromthetrainingwindowthemodelisupdatedfollowingtwoprocesses alearningprocessupdatethemodelbasedonthenewdataandaforgettingprocess discarddatathatismovingoutofthewindowthekeychallengeistoselectanappro priate window size short window reflects current distribution accurately thus assure fast adaptation times concept changes stable periods short window worsens performance system large window givesabetterperformanceinstableperiodsbutitreactstoconceptchangesslower ingeneralthetrainingwindowsizecanbefixedorvariableovertime slidingwindowsofafixedsize store memory fixed number recent examples whenever new example arrives saved memory oldest one discarded simple adaptive learning method often used baseline inevaluationofnewalgorithms slidingwindowsofvariablesize varythenumberofexamplesinawindowovertime typically depending indications change detector straightforward ap proachistoshrinkthewindowwheneverachangeissingledsuchthatthetraining datareflectsthemostrecentconceptandgrowthewindowotherwise one first algorithms using adaptive window size flora2 widmer andkubat1996incomingexamplesareaddedtothewindowandtheoldestonesare deleted addition deletion keeps window predictive model consis tent current concept versions algorithm deal recurring concepts flora3 noisy data flora4 later study klinkenberg joachims 2000presentsatheoreticallysupportedmethodforrecognizingandhandlingconcept changes support vector machines method maintains window training examples appropriate size key idea adjust window sizebasedontheestimateofthegeneralizationerrorateachtimestepthealgorithm buildsanumberofsvmmodelsusingvariouswindowsizesandselectsthethewindow sizethatminimizestheleaveoneouterrorestimateasthetrainingwindow learning windows variable length appear maloof michalski 1995 klinkenberg 2004 gama et al 2004 kuncheva zliobaite 2009 assump tion behind relying windowing recency data associated relevance importance unfortunately assumption may true every circumstanceforinstancewhenthedataisnoisyorconceptsreoccurrecencyofdata mean relevance moreover slow change lasts longer window size windowingmayfailaswell 312 forgetting mechanism common approach deal evolving data generatedfromprocesseswithunknowndynamicsisforgettingtheoutdatedobserva tionsthechoiceofaforgettingmechanismdependsontheexpectationsthatwehave regarding changes data distribution tradeoff reactivity ro acmcomputingsurveysvol1no1article1publicationdatejanuary2013 asurveyonconceptdriftadaptation 113 bustness noise system required abrupt forgetting faster thereactivitybutalsothehighertheriskofcapturingnoiseis abrupt forgetting time set observations defines window information considered learning abrupt forgetting partial memory refers mechanisms given observation either inside outside training windowseveralwindowmodelshavebeenpresentedintheliteraturetwobasictypes sliding windows babcock et al 2002 sequence based size windowischaracterizedbythenumberofobservationsandiitimestampbasedwhere thesizeofawindowisdefinedbydurationtime two models sequence based windows sliding windows size j landmarkwindowsaslidingwindowstoresonlythemostrecentexamplesinthefirst infirstout fifo data structure landmark window stores examples given timsetamp called landmark landmark window window variable size
Gama_ACMCS_AdaptationCD_accepted.pdf,9,timestamp based window size includes elements arrivedwithinthetimefromtunitsoftimebackuntilnowlearningsystemsthatuse abruptforgettingwherediscussedintheprevioussection oneofthealternativestoovercomewindowingespeciallyfixedwindowingissam pling goal summarize underlying characteristics data stream long periods time every included sample drawn uniformly stream one well known algorithm reservoir sampling vitter 1985 goal ofthereservoirsamplingistoobtainarepresentativesamplefortheobservedstream operates follows ith item arrives stored reservoir probabilityp kiwherek isthesizeofthereservoiranddiscardedwiththeproba bility1pifpositivethenarandomlychosensampleisdiscardedfromthereservoir free space new sample number sampling techniques inves tigated like alkateb et al 2007 efraimidis spirakis 2006 aggarwal 2006 rusuanddobra2009reservoirsamplinghasbeendiscussedinsomestudiesrelated drift change detection alternative windowing ng dash 2008 yaoetal2012zhaoetal2011 gradualforgetting gradualforgettingisafullmemoryapproachwhichmeans thatnoexamplesarecompletelydiscardedfromthememoryexamplesinmemoryare associatedwithweightsthatreflecttheirageexampleweightingisbasedonasimple intuition importance example training set decrease itsagesupposethatattimeithestoredsufficientstatisticsiss andweobservean i1 examplex assuminganaggregationfunctiongxsthenewsufficientstatisticsis computedass gx αs whereα01isthefadingfactorthiswaytheoldest i1 informationbecomestheleastimportant linear decay techniques found koychev 2000 2002 technique exponentialdecayispresentedinklinkenberg2004thelattertechniqueweightsex amplesaccordingtotheirageusinganexponentialageingfunctionw xexpλj λ example x appeared j time steps ago parameter λ controls fast theweightsdecreaseforlargervaluesofλalowerweightisassignedtooldexamples deemed less informative current prediction λ 0 exampleshavethesameweight memorymethodsaresummarizedintablei 32 changedetection thechangedetectioncomponentreferstothetechniquesandmechanismsforexplicit driftandchangedetectionitcharacterizesandquantifiesconceptdriftbyidentifying changepointsorsmalltimeintervalsduringwhichchangesoccurbassevilleandniki forov1993weconsiderthefollowingdimensionsasillustratedinfigure6imethods acmcomputingsurveysvol1no1article1publicationdatejanuary2013 114 jgamaetal tableicategorizationofmemorytechniques datamanagement schlimmerandgranger1986littlestone1987 singleexample domingosandhulten2000 kunchevaandplumpton2008kellyetal1999 bouchachia2011aikonomovskaetal2011 salganicoff1997widmerandkubat1996 fixedsize syedetal1999hultenetal2001lazarescuetal2004 multipleexamples bifetandgavalda20062007gomesetal2011 maloofandmichalski1995klinkenberg2004 variablesize gamaetal2004 zhangetal2008kunchevaandzliobaite2009 forgettingmechanisms salganicoff1997widmerandkubat1996 temporalsequences forman2006klinkenberg2004pechenizkiyetal2009 abruptforgetting nganddash2008yaoetal2012delanyetal2005 sampling zliobaite2011azhaoetal2011salganicoff1993 koychev20002002helmboldandlong1994 gradualforgetting klinkenberg2004koren2010 sequentialanalysis controlcharts detectionmethods monitoring twodistributions contextual noitcetedegnahc fig6 taxonomyofcontrolpropertiesofmethods based sequential analysis ii methods based control charts iii methods based ondifferencesbetweentwodistributionsivheuristicmethods already pointed online learning systems without explicit change detection mechanism adapt evolving data advantage explicit change detectionisprovidinginformationaboutthedynamicsoftheprocessgeneratingdata atypicalsectionstrategymonitorstheevolutionoftheperformanceindicatorswid mer kubat 1996 zeira et al 2004 raw data statistically compares toafixedbaselineaseminalworkinadaptivelearningwithmonitoringperformance indicatorsistheflorafamilyofalgorithmstheflora2algorithmwidmerandkubat 1996includesawindowadjustmentheuristicforarulebasedclassifiertodetectcon cept changes accuracy coverage current model monitored thewindowsizeisadaptedaccordinglyinthecontextofinformationfilteringmonitor ingthevaluesofthreeperformanceindicatorsaccuracyrecallandprecisionhasbeen proposedklinkenbergandrenz1998theposteriorofeachindicatoriscomparedto thestandardsampleerrorsofamovingaveragevalue 321 detectors based sequential analysis sequential probability ratio test sprt wald 1947 basis several change detection algorithms let xn 1 sequenceofexampleswherethesubsetofexamplesxw1 w nisgeneratedfrom 1 unknown distribution p subset xn generated another unknown 0 w distributionp whentheunderlyingdistributionchangesfromp top atpointwthe 1 0 1 probability observing certain subsequences p expected significantly 1 higher p significance means ratio two probabilities 0 smaller threshold assuming observations x independent statisticfortestingthehypothesisthatachangepointoccurredattimew againstthe acmcomputingsurveysvol1no1article1publicationdatejanuary2013 asurveyonconceptdriftadaptation 115 nullhypothesisthattherewasnochangeattimewisgivenby n tn
